experiment	track	primary_metric	status	commit	description
E0001	glm	0.454861	discard	9edcd2af6603b1367dfc6d49be53115e9bc8a4df	GLM-OHE anchor (intentional replication of the committed baseline config): the v0.4.0 registry val_poisson_deviance reproduces study-04's hand-rolled 0.454861 to 1e-9 on identical prep/split; any mismatch means split/weight/clip drift - STOP; guardrails failed: guardrail metric 'wall_seconds' missing
E0002	glm	0.454861	keep	58c69704a217fe005bcde911658f4076dfe7fa0a	GLM-OHE anchor rerun after F1 harness fix (wall_seconds now printed via extra): registry val_poisson_deviance must reproduce study-04's 0.454861 to 1e-9 - STOP on mismatch; first valid result on this track
E0003	gbdt	0.444689	keep	9e25b0692d9d5cbf06f3836515ee4fe0e573e60a	HGBT-OHE anchor (seed 0, lr 0.1, 200 iters, 31 leaves): registry val_poisson_deviance must reproduce study-04's 0.444689 to 1e-9; effective_trees logged per method-card R1 (early_stopping auto engages >10k rows); first valid result on this track
E0004	glm	0.453156	keep	288665c5d5fa72acd2d79c5113eb8161f7763e74	RQ4: column-SCOPED splines (DrivAge/BonusMalus/log-Density only; basis never touches OHE dummies, fixing study-04 E0002 leak) close >=30% of the 0.010172 gap; pre-loop signal says ~16.8% - prior doubted, honest-no informs the translate-back program either way; frontier improvement over 0.454861 with minimum_delta=0.000539
E0005	gbdt	0.444413	discard	336b4054732518e1b879db23761d9a038b73ea03	RQ2/M1: LightGBM poisson at nominal-matched config (31 leaves, lr .1, 200 rounds) lands within 2x gbdt floor 0.000573 of HGBT 0.444689 - tie predicted DISCARD; capacity confound acknowledged: HGBT effective_trees=67 (early stopping) vs LGBM full 200; M1-b matched-capacity lever fires in adaptive-3 only if this breaks the tie; did not improve track frontier 0.444689 by minimum_delta=0.000573
E0006	gbdt	0.446332	discard	d1285986164e88736ef4cebc9b57f5608fbc4abb	RQ3/M2: CatBoost Poisson (CTR categorical statistics + symmetric trees, boosting_type=Plain on CPU, depth 6, 200 iters, Exponent predictions) vs HGBT-OHE incumbent at cardinality <=22 (Region 22, VehBrand 11): prior says NO pay - pre-loop deficit +0.001643 = 2.9x gbdt floor; wording per method-card R3: this tests the CTR+symmetric package, NOT ordered boosting; did not improve track frontier 0.444689 by minimum_delta=0.000573
E0007	glm	0.452926	discard	3bb72d1a08c2822958605f46f8f513010e8c13b9	RQ5/M4: + top TRAIN-fold surrogate interaction VehAge x BonusMalus (rank 1/10, |resid corr| 0.1536; PD strength 0.029; DrivAge x BonusMalus ranked 8/10 - literature prior refuted in ranking). Screened 10 pairs, adopting 1. Predicted: closes >= 2x glm floor 0.000539 beyond E0004's 0.453156; did not improve track frontier 0.453156 by minimum_delta=0.000539
E0008	glm	0.452913	discard	d53e3cc82cb855c835770ba9a0908e96906ba143	RQ5/M4-c ceiling: + BOTH top surrogate pairs (VehAge x BonusMalus 0.1536, BonusMalus x logDensity 0.0985; PD strengths 0.029/0.043). Screened 10, adopted 2, rejections reported. E0007 showed pair 1 alone buys 0.43x floor; prediction now honest-uncertain: two products still < 1x glm floor beyond E0004 -> the scoped-spline model IS the practical GLM ceiling; did not improve track frontier 0.453156 by minimum_delta=0.000539
E0009	gbdt	0.447455	discard	b87d6a5e470e6db69fd2fdf4370ef5cd4810460f	RQ7/M3: monotone +1 BonusMalus on the NATIVE-categorical HGBT. Constraint cost read TWO ways per method-card R2: vs same-encoding unconstrained control (study-04 E0004 native 0.445343, tag v1.0.0, same split/prep) and vs the OHE incumbent 0.444689 (total cost incl. encoding). Prediction: constraint component < 1x gbdt floor 0.000573 - filability nearly free; did not improve track frontier 0.444689 by minimum_delta=0.000573
E0010	gbdt	0.444431	discard	35c5de935ca29f9f4698db6a7a6548e33011ba1d	M1-b: LightGBM poisson at n_estimators=67 - matched to HGBT's EFFECTIVE capacity (E0003 early-stopped at 67 trees). Prediction: |delta| vs 0.444689 stays < 2x gbdt floor 0.000573 -> the RQ2 tie is algorithmic, not an early-stopping artefact; did not improve track frontier 0.444689 by minimum_delta=0.000573
E0011	glm	0.459231	discard	9aa393226553039f0ea6b3b8b2a74bfb7280214e	sealed confirmation of the glm incumbent (E0004 scoped splines) + holdout prediction export for the off-ledger sealed-gap computation; sealed final-test evidence; excluded from the adaptive frontier
E0012	gbdt	0.449667	discard	bf7677d47c0b15aa8315157574d323411da0834c	sealed confirmation of the gbdt incumbent (E0003 hgbt_ohe, seed 0, lr .1, nominal 200 iters) + holdout prediction export for the off-ledger sealed-gap computation; sealed final-test evidence; excluded from the adaptive frontier
