experiment	track	primary_metric	status	commit	description
E0001	primary	0.61414	keep	edb1ce6b605fb6b091b2a52121848fa9ec42df88	E0001 anchor: the v1 split-identity rung (LR + OHE(min_frequency=20) + class_weight=balanced) refitted on the identical v1 training rows; decides P1; first valid result on this track
E0002	primary	0.650095	discard	765ce2742968cea1701f6ac014b303b07cb2c0ab	E0002 spline+isotonic: the v1 E2-redux chain (quantile-knot splines on 3 numerics, log1p density, 2 interactions, isotonic cv=5) against the anchor refitted on the same rows; decides P2 and P3; did not improve track frontier 0.61414 by minimum_delta=0.0375805
E0003	primary	0.664051	keep	c846660d73b119a1bf1ebe3ab172059a826febfb	E0003 HGBT: the v1 tree rung (learning_rate 0.05, 500 iters, 31 leaves, class_weight=balanced, early stopping), the only rung recoverable verbatim from a committed file, against the calibrated GLM refitted on the same rows; decides P4 and P5; frontier improvement over 0.61414 with minimum_delta=0.0375805
E0004	primary	0.612675	discard	9400da7f0f99621f758f1f9c4be58c694f366176	E0004 doctrine A/B: the anchor with class_weight=None plus isotonic calibration (cv=5) against the same rung with class_weight=balanced refitted on the same rows; decides P6; did not improve track frontier 0.664051 by minimum_delta=0.0375805
E0005	primary	0.657739	discard	8ff65f193abff773209388f44c638fb30ce6688e	E0005 sealed confirmation: E0003's configuration unchanged, fitted on train+development and evaluated once on the sealed half of the v1 validation set; decides P7; sealed final-test evidence; excluded from the adaptive frontier
