experiment	track	primary_metric	status	commit	description
E0001	reproduction	0.00309	discard	443457e27cb412a72ed8d5f1a482d6c1f81648cc	data-identity + single-cell anchor under the REGISTERED default (hazen, k=8): identity gate must pass (STOP on miss); the single gqls lognormal (0.05,0.95) cell lands within 0.005 of published 22.79/0.82 - but the W guardrail is predicted to BREACH (max_abs_w_deviation ~0.49 > 0.10), an honest discard that forces the convention question the thesis itself defines (inverted_cdf, ch.2); guardrails failed: max_abs_w_deviation=0.4939943004986853 > max 0.1; max_abs_p_deviation=0.059403995101279694 > max 0.02
E0002	reproduction	0.009303	discard	717e414fd4f9c5a636ae3bdb88ddd783ce144371	full 18-cell gQLS grid under the registered hazen default vs Table 6.9: predicted mean ~0.0093 with max_abs_param_deviation ~0.032 BREACHING the 0.02 guardrail - the descriptive convention cannot reproduce the thesis's estimation tables (discard predicted; the fix is the thesis's own ch.2 definition); guardrails failed: max_abs_param_deviation=0.03127860951692235 > max 0.02; max_abs_w_deviation=1.2855176512015198 > max 0.1; max_abs_p_deviation=0.15813481258285722 > max 0.02
E0003	reproduction	0.002754	keep	151cd8da2c647fb35020a671c9e4f02516d82d7e	the thesis's OWN convention (ch.2: quantile = X_ceil(np), inverted_cdf), one CONFIG line changed: full 18-cell grid predicted mean ~0.00275 with all guardrails passing (max ~0.0187, driven solely by Table 6.9's log-Gumbel (0.10,0.90) typo cell - our 22.3587 agrees with Table 6.10's 22.36) - KEEP predicted, RQ1 answered; first valid result on this track
E0004	reproduction	0.002754	discard	1fb45f1e0aa69ead4e0ea5b5353fd1f3d73f95ad	RQ2: W_out in both modes (chi2_23 reference vs the thesis's prescribed B=1000 parametric bootstrap) across the 18 cells - prediction REVISED at method gate: 16/18 published p-values sit within 0.005 of chi2_23 (tighter than bootstrap MC error allows, suggesting the published values are chi2-derived despite the prescription) while 2/18 diverge (log-Logistic (0.02,0.98) delta 0.434; log-Laplace (0.10,0.90) delta 0.100); our bootstrap-vs-chi2 agreement quantified in aux; did not improve track frontier 0.002754 by minimum_delta=0.005
E0005	reproduction	0.002754	discard	3b358d70ff29c61fcfa2ef96bc7fdd509f0a31ab	oQLS (o2/o3) + MLE arms, all six families, ORIGINAL data, vs the corresponding Table 6.10 original rows - the Sigma-star falsifier: our o2 log-Cauchy sigma vs published 0.23 and g2 vs 0.49; MLE arms vs published (lognormal already anchor-exact 22.8002/0.8339); did not improve track frontier 0.002754 by minimum_delta=0.005
E0006	decision	58.063948	keep	bcc56e2854de8d1e50186653d1a620215e35fcf9	RQ5 baseline: MLE-lognormal 1-in-100 instability under the adaptive stress set (leave-top-1/2/3, 5x max) - audit preview says leave-1 alone moves -25.7%; prediction: instability_pct > 40; w_pvalue guardrail from the clean fit; first valid result on this track
E0007	decision	62.9414	discard	6f91dc8ac14114676d29ebd78060b6cdec4c1a7f	RQ5 live question: gQLS log-Cauchy (0.05,0.95) - the best-FITTING family (W p 0.82) whose quantile transform amplifies sigma by tan(0.49pi)=31.8 at p=0.99; registered prediction: instability < 1/3 of MLE-lognormal's (i.e. < 19.4); the metrology floor already warns its 1-in-100 carries a 3.6 log-SE - REFUTATION would be the seminar punchline (robust parameters, unstable decisions); did not improve track frontier 58.063948 by minimum_delta=1
E0008	decision	41.325245	keep	9a6562f582bdb3baa7143564cb59f1786e9d6d5b	RQ6: gQLS lognormal (0.05,0.95) - a GoF-passing family (W p 0.52) with a LIGHT quantile transform (z_0.99 = 2.326, not 31.8): prediction - materially more stable 1-in-100 than both log-Cauchy (62.9) and MLE-lognormal (58.1); trimmed quantile estimation + bounded transform = the robustness that actually reaches the decision; frontier improvement over 58.063948 with minimum_delta=1
E0009	decision	27.584597	keep	5e05c8022a7892663a21d448e27a6085ebde32fa	RQ4/RQ6: gQLS lognormal at the WIDEST trim (0.10,0.90), breakdown point 0.10 > 3/30 - all three leave-top-k stresses now sit inside the breakdown guarantee (k=3: 0.10 <= 0.10 boundary); prediction: instability monotone decreasing in min{a,1-b}, beating E0008's 41.3 by > 1.0pp, at a GoF cost < 1x the W floor (published W p 0.73 at this trim); frontier improvement over 41.325245 with minimum_delta=1
E0010	reproduction	0.002026	discard	346dc4e8331a505e8bc480467fc5fce2fecf6420	sealed reproduction confirmation vs the FULL published Table 6.10 grid: all five estimator arms (mle, o2, o3, g2, g3) x six families on ORIGINAL and 10x-MODIFIED data - 120 published parameters never touched adaptively (adaptive work was confined to Table 6.9); sealed final-test evidence; excluded from the adaptive frontier
E0011	decision	0	discard	0f00ed4a73fcd9b02c98f9dd2273df149ab6d36a	sealed decision confirmation: the incumbent (gQLS lognormal, trim (0.10,0.90)) under the thesis's EXACT 10x modification (72.303 -> 723.03) - the one contamination never used adaptively (adaptive stress capped at 5x); MLE-lognormal moves +99.4% under this same stress per the audit preview; the incumbent's trimmed quantiles are predicted to sit at 0.0%; sealed final-test evidence; excluded from the adaptive frontier
