experiment	track	primary_metric	status	commit	description
E0001	primary	1.572174	keep	d17fc8ef2e95e3a863732d426f0fa7c00c3f0934	E0001 identity anchor: the committed anchor recipe at seed 20260903, a seed the Phase-0 floor sweep never used; adjudicates P1; first valid result on this track
E0002	primary	1.584747	discard	c53d68643421186c7af4d260fde90a84126b282b	E0002: 200-step linear learning-rate warmup, one change from the anchor at the same 2000 steps and the same seed; adjudicates P2; did not improve track frontier 1.572174 by minimum_delta=0.0149525
E0003	primary	1.739149	discard	9b6f213d58f507e5614dd1365cf9a9d47df7beba	E0003: weight tying — the output head shares the token embedding (1.0% of parameters), one change from the anchor at the same 2000 steps and the same seed; adjudicates P3; did not improve track frontier 1.572174 by minimum_delta=0.0149525
E0004	primary	1.639808	discard	fe6abc706bf33596f89bca86e590935bfb019a7c	E0004: dropout 0.1, one change from the anchor at the same 2000 steps and the same seed; adjudicates P4; did not improve track frontier 1.572174 by minimum_delta=0.0149525
E0005	primary	1.57624	discard	626427c5822afc46462e1d9d6c79c6125c8d959f	E0005: width 128 to 256 at the same 2000 steps, one change from the anchor with the same seed; adjudicates P5; did not improve track frontier 1.572174 by minimum_delta=0.0149525
E0006	primary	1.519319	keep	341279f9f8b8d44c6052b4ef41dd3cdbeef5336e	E0006: cosine learning-rate decay from 3e-3 to 10% of it over the same 2000 steps, one change from the anchor with the same seed; no registered prediction, exploratory; frontier improvement over 1.572174 with minimum_delta=0.0149525
E0007	primary	1.520867	discard	05c4b0afb669d05a10fcacd62da5135a695ef4c7	E0007: 200-step linear warmup added to the E0006 cosine incumbent — does warmup pay once it is paired with the decay it is normally used with? No registered prediction, exploratory; did not improve track frontier 1.519319 by minimum_delta=0.0149525
E0008	primary	1.56628	discard	af69e4daa38748e45fa9ff7cbfd0d71bef4f7951	sealed confirmation of the selected candidate: the E0006 cosine-decay recipe, retrained on train+development and scored once on the sealed final tenth; adjudicates P6; sealed final-test evidence; excluded from the adaptive frontier
