experiment	track	primary_metric	status	commit	description
E0001	primary	0.806201	keep	9be94e607ef2dd881073a200493d588619536697	E0001 anchor: the raw-feature logistic identity anchor — how far is a single hyperplane from the known ceiling?; first valid result on this track
E0002	primary	0.835785	keep	a3236e68ff6439b43da333f925271f05976c29f8	E0002: hand the linear model the DGP's true x1*x2 interaction — does the term the hyperplane could not express buy more than a floor?; frontier improvement over 0.806201 with minimum_delta=0.00745212
E0003	primary	0.87139	keep	061a079ab2b901f421af60f904ee744cfb8bf7cb	E0003: a boosted tree told none of the true terms — can it beat the hand-specified interaction rung it was never shown?; frontier improvement over 0.835785 with minimum_delta=0.00745212
E0004	primary	0.858049	discard	a6c5fa494e8f10edbc8dfa6a9c14d890be8a0b87	E0004: the over-capacity boosted tree — 500 trees, 127 leaves, no shrinkage discipline, no early stopping. Does buying capacity at h = 1.708 buy anything the floor can see?; did not improve track frontier 0.87139 by minimum_delta=0.00745212
E0005	primary	0.880949	discard	3f1017d8fcf502dbdc95279070f28dc8dc7457ad	E0005 sealed: E0003's configuration, once, on the held-out partition — does it land within two measured floors of that partition's own Bayes ceiling?; sealed final-test evidence; excluded from the adaptive frontier
